Question,Answer
What is the admission process?,"The admission process usually includes filling out the application form, submitting required documents, and completing counseling or verification."
How can I apply for admission?,"You can apply for admission by visiting the official college website or admission office and submitting the application form with the required documents."
What documents are required for admission?,"Commonly required documents include mark sheets, transfer certificate, ID proof, passport-size photos, caste certificate if applicable, and migration certificate if required."
What courses are available?,"The college offers courses in multiple streams. Please check the course list or contact the admission office for the latest available programs."
Do you offer computer science courses?,"Yes, computer science or IT-related courses may be available depending on the current academic offerings."
What is the fee structure?,"The fee structure depends on the selected course and academic year. Please contact the accounts or admission office for exact fee details."
Can I pay fees online?,"Online fee payment may be available through the official portal. Please confirm the payment options with the college office."
Is hostel facility available?,"Yes, hostel facilities may be available for students, subject to room availability and college rules."
What are the hostel fees?,"Hostel fees depend on the room type and facilities provided. Please contact the hostel office for exact charges."
Does the college provide placements?,"Yes, the college may provide placement assistance through its training and placement cell."
Which companies visit for placement?,"Companies visiting for placement can vary each year. The placement cell can provide the latest recruiter details."
How can I contact the college?,"You can contact the college through the official phone number, email address, or by visiting the admission office."
